{
  "subsystem": "project_account",
  "evidence": {
    "manifest": {
      "name": "Project - Account",
      "category": "Accounting/Accounting",
      "depends": [
        "account",
        "project"
      ],
      "auto_install": true,
      "application": false
    },
    "models": [],
    "routes": [],
    "security": {
      "access_rules": 0,
      "record_rules": 0,
      "groups": 0
    },
    "views": {
      "form": 0,
      "list": 0,
      "tree": 0,
      "kanban": 0,
      "search": 0,
      "pivot": 0,
      "graph": 0,
      "calendar": 0,
      "activity": 0
    },
    "frontend": {
      "present": false,
      "js_files": 0,
      "xml_templates": 0,
      "owl_components": [],
      "registry_adds": [],
      "patches": [],
      "services": [],
      "asset_bundles": {}
    },
    "integrations": {
      "http_call_sites": 0,
      "sdk_imports": [],
      "uses_api_keys": false,
      "endpoints": [],
      "files": []
    },
    "runtime": {
      "models_with_data": 0,
      "top": []
    },
    "behavioral_notes": [
      {
        "element": "thin module",
        "observation": "0 models, 0 routes, 302 py LOC — baseline record (auto-architect); deep method semantics not code-read.",
        "source": "ast"
      }
    ]
  },
  "it_architecture": {
    "application": "project_account (Project - Account)",
    "software_services": [],
    "data_objects": [],
    "logical_data_erm": [],
    "information_flows": [
      "depends: account, project"
    ],
    "frontend_components": []
  },
  "business_architecture": {
    "capabilities": [
      "Project - Account"
    ],
    "value_streams": [],
    "information_concepts": [],
    "organization": [],
    "products": [],
    "policies": [],
    "stakeholders": [],
    "strategy": null,
    "metrics": []
  },
  "classification": {
    "value_model": "shop",
    "activity_class": "primary",
    "apqc_category": "5.0 Deliver Services",
    "rationale": "project_account: thin shop/primary module (auto-architect baseline)."
  },
  "fit_to_standard": {
    "standard_capabilities": [
      "Project - Account"
    ],
    "typical_fits": [],
    "common_gaps": [],
    "drive_hints": [
      "n/a"
    ]
  },
  "reverse_eng_confidence": {
    "information_concepts": "auto",
    "organization": "auto",
    "products": "auto",
    "capabilities": "inferred",
    "value_streams": "inferred",
    "policies": "inferred",
    "metrics": "inferred",
    "strategy": "human"
  },
  "open_questions": [
    "Baseline auto-architect record; method semantics + value-stream not deeply code-read."
  ],
  "provenance": {
    "explorer_facts": "doc/revres/facts/project_account.facts.json",
    "tools": [
      "extract_module.py",
      "extract_frontend.py",
      "gen_thin.py"
    ],
    "odoo_version": "19.0"
  }
}