{
  "subsystem": "account_edi",
  "evidence": {
    "manifest": {
      "name": "Import/Export Invoices From XML/PDF",
      "category": "Accounting/Accounting",
      "depends": [
        "account"
      ],
      "auto_install": false,
      "application": false
    },
    "models": [
      {
        "_name": "account.edi.document",
        "_description": "Electronic Document for an account.move",
        "fields": 9
      },
      {
        "_name": "account.edi.format",
        "_description": "EDI format",
        "fields": 2
      }
    ],
    "routes": [],
    "security": {
      "access_rules": 4,
      "record_rules": 0,
      "groups": 0
    },
    "views": {
      "form": 0,
      "list": 2,
      "tree": 0,
      "kanban": 0,
      "search": 0,
      "pivot": 0,
      "graph": 0,
      "calendar": 0,
      "activity": 0
    },
    "frontend": {
      "present": false,
      "js_files": 0,
      "xml_templates": 0,
      "owl_components": [],
      "registry_adds": [],
      "patches": [],
      "services": [],
      "asset_bundles": {}
    },
    "integrations": {
      "http_call_sites": 0,
      "sdk_imports": [],
      "uses_api_keys": false,
      "endpoints": [],
      "files": []
    },
    "runtime": {
      "models_with_data": 0,
      "top": []
    },
    "behavioral_notes": [
      {
        "element": "thin module",
        "observation": "2 models, 0 routes, 1369 py LOC — baseline record (auto-architect); deep method semantics not code-read.",
        "source": "ast"
      }
    ]
  },
  "it_architecture": {
    "application": "account_edi (Import/Export Invoices From XML/PDF)",
    "software_services": [],
    "data_objects": [
      "account.edi.document",
      "account.edi.format"
    ],
    "logical_data_erm": [
      "account.edi.document -> account.edi.format",
      "account.edi.document -> account.move",
      "account.edi.document -> ir.attachment"
    ],
    "information_flows": [
      "depends: account"
    ],
    "frontend_components": []
  },
  "business_architecture": {
    "capabilities": [
      "Import/Export Invoices From XML/PDF"
    ],
    "value_streams": [],
    "information_concepts": [
      "account.edi.document",
      "account.edi.format"
    ],
    "organization": [],
    "products": [],
    "policies": [],
    "stakeholders": [],
    "strategy": null,
    "metrics": []
  },
  "classification": {
    "value_model": "support",
    "activity_class": "support",
    "apqc_category": "9.0 Manage Financial Resources",
    "rationale": "account_edi: thin support/support module (auto-architect baseline)."
  },
  "fit_to_standard": {
    "standard_capabilities": [
      "Import/Export Invoices From XML/PDF"
    ],
    "typical_fits": [],
    "common_gaps": [],
    "drive_hints": [
      "odoo shell: env['account.edi.document'].search([],limit=3)"
    ]
  },
  "reverse_eng_confidence": {
    "information_concepts": "auto",
    "organization": "auto",
    "products": "auto",
    "capabilities": "inferred",
    "value_streams": "inferred",
    "policies": "inferred",
    "metrics": "inferred",
    "strategy": "human"
  },
  "open_questions": [
    "Baseline auto-architect record; method semantics + value-stream not deeply code-read."
  ],
  "provenance": {
    "explorer_facts": "doc/revres/facts/account_edi.facts.json",
    "tools": [
      "extract_module.py",
      "extract_frontend.py",
      "gen_thin.py"
    ],
    "odoo_version": "19.0"
  }
}