{
  "subsystem": "sale_timesheet_margin",
  "evidence": {
    "manifest": {
      "name": "Service Margins in Sales Orders",
      "category": "Sales/Sales",
      "depends": [
        "sale_margin",
        "sale_timesheet"
      ],
      "auto_install": true,
      "application": false
    },
    "models": [],
    "routes": [],
    "security": {
      "access_rules": 0,
      "record_rules": 0,
      "groups": 0
    },
    "views": {},
    "frontend": {
      "present": false,
      "js_files": 0,
      "xml_templates": 0,
      "owl_components": [],
      "registry_adds": [],
      "patches": [],
      "services": [],
      "asset_bundles": {}
    },
    "integrations": {
      "http_call_sites": 0,
      "sdk_imports": [],
      "uses_api_keys": false,
      "endpoints": [],
      "files": []
    },
    "runtime": {
      "models_with_data": 0,
      "top": []
    },
    "behavioral_notes": [
      {
        "element": "thin module",
        "observation": "0 models, 0 routes, 269 py LOC — baseline record (auto-architect); deep method semantics not code-read.",
        "source": "ast"
      }
    ]
  },
  "it_architecture": {
    "application": "sale_timesheet_margin (Service Margins in Sales Orders)",
    "software_services": [],
    "data_objects": [],
    "logical_data_erm": [],
    "information_flows": [
      "depends: sale_margin, sale_timesheet"
    ],
    "frontend_components": []
  },
  "business_architecture": {
    "capabilities": [
      "Service Margins in Sales Orders"
    ],
    "value_streams": [],
    "information_concepts": [],
    "organization": [],
    "products": [],
    "policies": [],
    "stakeholders": [],
    "strategy": null,
    "metrics": []
  },
  "classification": {
    "value_model": "chain",
    "activity_class": "primary",
    "apqc_category": "3.0 Market and Sell Products and Services",
    "rationale": "sale_timesheet_margin: thin chain/primary module (auto-architect baseline)."
  },
  "fit_to_standard": {
    "standard_capabilities": [
      "Service Margins in Sales Orders"
    ],
    "typical_fits": [],
    "common_gaps": [],
    "drive_hints": [
      "n/a"
    ]
  },
  "reverse_eng_confidence": {
    "information_concepts": "auto",
    "organization": "auto",
    "products": "auto",
    "capabilities": "inferred",
    "value_streams": "inferred",
    "policies": "inferred",
    "metrics": "inferred",
    "strategy": "human"
  },
  "open_questions": [
    "Baseline auto-architect record; method semantics + value-stream not deeply code-read."
  ],
  "provenance": {
    "explorer_facts": "doc/revres/facts/sale_timesheet_margin.facts.json",
    "tools": [
      "extract_module.py",
      "extract_frontend.py",
      "gen_thin.py"
    ],
    "odoo_version": "19.0"
  }
}