{
  "subsystem": "payment_ecpay",
  "evidence": {
    "manifest": {
      "name": "Payment Provider: ECPay",
      "category": "Accounting/Payment Providers",
      "depends": [
        "payment"
      ],
      "auto_install": false,
      "application": false
    },
    "models": [],
    "routes": [
      {
        "paths": [],
        "auth": "public",
        "type": "http"
      },
      {
        "paths": [],
        "auth": "public",
        "type": "http"
      }
    ],
    "security": {
      "access_rules": 0,
      "record_rules": 0,
      "groups": 0
    },
    "views": {
      "form": 1,
      "list": 0,
      "tree": 0,
      "kanban": 0,
      "search": 0,
      "pivot": 0,
      "graph": 0,
      "calendar": 0,
      "activity": 0
    },
    "frontend": {
      "present": false,
      "js_files": 0,
      "xml_templates": 0,
      "owl_components": [],
      "registry_adds": [],
      "patches": [],
      "services": [],
      "asset_bundles": {}
    },
    "integrations": {
      "http_call_sites": 0,
      "sdk_imports": [],
      "uses_api_keys": false,
      "endpoints": [
        "https://payment-stage.ecpay.com.tw/Cashier/AioCheckOut/V5",
        "https://payment.ecpay.com.tw/Cashier/AioCheckOut/V5"
      ],
      "files": [
        "models/payment_provider.py"
      ]
    },
    "runtime": {
      "models_with_data": 0,
      "top": []
    },
    "behavioral_notes": [
      {
        "element": "thin module",
        "observation": "0 models, 2 routes, 669 py LOC — baseline record (auto-architect); deep method semantics not code-read.",
        "source": "ast"
      }
    ]
  },
  "it_architecture": {
    "application": "payment_ecpay (Payment Provider: ECPay)",
    "software_services": [],
    "data_objects": [],
    "logical_data_erm": [],
    "information_flows": [
      "depends: payment"
    ],
    "frontend_components": []
  },
  "business_architecture": {
    "capabilities": [
      "Payment Provider: ECPay"
    ],
    "value_streams": [],
    "information_concepts": [],
    "organization": [],
    "products": [],
    "policies": [],
    "stakeholders": [],
    "strategy": null,
    "metrics": []
  },
  "classification": {
    "value_model": "network",
    "activity_class": "support",
    "apqc_category": "9.0 Manage Financial Resources",
    "rationale": "payment_ecpay: thin network/support module (auto-architect baseline)."
  },
  "fit_to_standard": {
    "standard_capabilities": [
      "Payment Provider: ECPay"
    ],
    "typical_fits": [],
    "common_gaps": [],
    "drive_hints": [
      "n/a"
    ]
  },
  "reverse_eng_confidence": {
    "information_concepts": "auto",
    "organization": "auto",
    "products": "auto",
    "capabilities": "inferred",
    "value_streams": "inferred",
    "policies": "inferred",
    "metrics": "inferred",
    "strategy": "human"
  },
  "open_questions": [
    "Baseline auto-architect record; method semantics + value-stream not deeply code-read."
  ],
  "provenance": {
    "explorer_facts": "doc/revres/facts/payment_ecpay.facts.json",
    "tools": [
      "extract_module.py",
      "extract_frontend.py",
      "gen_thin.py"
    ],
    "odoo_version": "19.0"
  }
}