{
  "subsystem": "test_spreadsheet",
  "evidence": {
    "manifest": {
      "name": "Spreadsheet Test",
      "category": "Hidden",
      "depends": [
        "spreadsheet"
      ],
      "auto_install": false,
      "application": false
    },
    "models": [
      {
        "_name": "spreadsheet.test",
        "_description": "Dummy Spreadsheet",
        "fields": 0
      }
    ],
    "routes": [],
    "security": {
      "access_rules": 2,
      "record_rules": 0,
      "groups": 1
    },
    "views": {},
    "frontend": {
      "present": false,
      "js_files": 0,
      "xml_templates": 0,
      "owl_components": [],
      "registry_adds": [],
      "patches": [],
      "services": [],
      "asset_bundles": {}
    },
    "integrations": {
      "http_call_sites": 0,
      "sdk_imports": [],
      "uses_api_keys": false,
      "endpoints": [],
      "files": []
    },
    "runtime": {
      "models_with_data": 0,
      "top": []
    },
    "behavioral_notes": [
      {
        "element": "thin module",
        "observation": "1 models, 0 routes, 75 py LOC — baseline record (auto-architect); deep method semantics not code-read.",
        "source": "ast"
      }
    ]
  },
  "it_architecture": {
    "application": "test_spreadsheet (Spreadsheet Test)",
    "software_services": [],
    "data_objects": [
      "spreadsheet.test"
    ],
    "logical_data_erm": [],
    "information_flows": [
      "depends: spreadsheet"
    ],
    "frontend_components": []
  },
  "business_architecture": {
    "capabilities": [
      "Spreadsheet Test"
    ],
    "value_streams": [],
    "information_concepts": [
      "spreadsheet.test"
    ],
    "organization": [],
    "products": [],
    "policies": [],
    "stakeholders": [],
    "strategy": null,
    "metrics": []
  },
  "classification": {
    "value_model": "support",
    "activity_class": "support",
    "apqc_category": "13.0 Develop and Manage Business Capabilities",
    "rationale": "test_spreadsheet: thin support/support module (auto-architect baseline)."
  },
  "fit_to_standard": {
    "standard_capabilities": [
      "Spreadsheet Test"
    ],
    "typical_fits": [],
    "common_gaps": [],
    "drive_hints": [
      "odoo shell: env['spreadsheet.test'].search([],limit=3)"
    ]
  },
  "reverse_eng_confidence": {
    "information_concepts": "auto",
    "organization": "auto",
    "products": "auto",
    "capabilities": "inferred",
    "value_streams": "inferred",
    "policies": "inferred",
    "metrics": "inferred",
    "strategy": "human"
  },
  "open_questions": [
    "Baseline auto-architect record; method semantics + value-stream not deeply code-read."
  ],
  "provenance": {
    "explorer_facts": "doc/revres/facts/test_spreadsheet.facts.json",
    "tools": [
      "extract_module.py",
      "extract_frontend.py",
      "gen_thin.py"
    ],
    "odoo_version": "19.0"
  }
}